{
  "localIdentifiers" : [ {
    "value" : "12345678ABC",
    "key" : "jisNumber"
  } ],
  "manufacturingInformation" : {
    "date" : "2022-02-04T14:48:54",
    "country" : "HUR",
    "sites" : [ {
      "catenaXsiteId" : "BPNS1234567890ZZ",
      "function" : "production"
    } ]
  },
  "catenaXId" : "urn:uuid:580d3adf-1981-44a0-a214-13d6ceed9379",
  "partTypeInformation" : {
    "partClassification" : [ {
      "classificationStandard" : "IEC",
      "classificationID" : "61360- 2:2012 ",
      "classificationDescription" : "Standard data element types with associated classification scheme for electric components."
    } ],
    "manufacturerPartId" : "123-0.740-3434-A",
    "customerPartId" : "PRT-12345",
    "nameAtManufacturer" : "Mirror left",
    "nameAtCustomer" : "side element A"
  }
}